ID,Label,Feature type,Meta-Category,Description
NCG07128,Hog Island Bay,Bay,Water,"name erroneously given to Cedar Island Bay, NE Carteret County, on the 1935 Soil Survey map."
NCG07130,Hog Island Point,Point,Landform,extends off the E mainland of Hyde County into Pamlico Sound.
NCG07131,Hog Island Swamp,Swamp,Wetlands,SW Sampson County S of Little Coharie Creek.
NCG07132,Hog Point,Point,Landform,a point of land in N Carteret County extending into the waters of Turnagain Bay.
NCG07134,Hog Swamp,Swamp,Wetlands,rises in S Robeson County and flows S into Ashpole Swamp.
NCG07139,Hogan's Lake,Lake,Water,"SE Orange County 2½ mi. NW of town of Carrboro. Alt. 488. Formed in 1930 by H. C. Hogan and named for his family. Covers 17 acres, with a max. depth of 15 ft. For private recreation."
NCG07150,Hoggard Swamp,Swamp,Wetlands,S Hertford County. Wiccacon River rises there.
NCG07154,Hogpen Bay,Bay,Water,in the waters of Core Sound extending into Core Banks in SE Carteret County.
NCG07160,Hogsed Cove,Cove,Water,"SE Clay County, through which Eagle Creek flows."
NCG07168,Holcombe Cove,Valley,Landform,the valley through which Moore Creek flows in SW Buncombe County.
NCG07169,Holden Beach,Beach,Landform,a section of outer beach in S Brunswick County W of Lockwoods Folly Inlet and E of Big Beach. Approx. 3Â½ mi. long. A summer resort with cottages is there.
NCG07170,Holden Cove,Cove,Water,SE Clay County between Big Kitchens and Little Kitchens Ridges.
NCG07174,Holiday Island,Island,Landform,"approx. 2 mi. long in the Chowan River, NW Chowan County. Formerly about 150 acres, but now only about 40 to 50 acres. Appears on the Collet map, 1770, as Holladay Island."
NCG07183,Holland's Point,Point,Landform,extends from E Onslow County into Queens Creek.
NCG07194,Hollow Ground Swamp,Swamp,Wetlands,in central Tyrrell County. See also Long Island.
NCG07211,Holly Point,Peninsula,Landform,"peninsula extending from W Goose Creek Island, NE Pamlico County, into Goose Creek at the mouth of Dixon Creek."
NCG07213,Holly Shelter Bay,Pocosin,Wetlands,"a pocosin in E Pender County bounded on the NE by Shaken Creek, on the W by Northeast Cape Fear River, and on the S by Trumpeter Swamp. It is about 10 mi. long and 7 mi. wide. Appears as Holly Schelter Precoson on the Collet map, 1770 (although mistakenly applied to Angola Bay), and on the Price map, 1808. Holly Shelter Wildlife Management Area, 48,470 acres, is operated by the N.C. Wildlife Resources Commission; bear and deer abound."
NCG07224,Holmes Point,Point,Landform,on the W side of New River in central Onslow County. Formerly known as Little Ragged Point.
NCG07227,Holt Lake,Lake,Water,"central Johnston County on Black Creek. Original dam constructed prior to 1911; present dam, downstream from first, built in early 1920s. Covers approx. 400 acres; max. depth 25 ft."
NCG07231,Holy Swamp,Swamp,Wetlands,rises in central Robeson County and flows SE into Big Raft Swamp.
NCG07238,Hominy Swamp,Swamp,Wetlands,rises in W central Wilson County and flows SE into Contentnea Creek. Appears in local records as early as 1764. Said to have been named for a hominy mill operated on its waters by that date.
NCG07241,Honey Island Swamp,Swamp,Wetlands,rises in W Brunswick and E Columbus Counties and flows SW along the Brunswick-Columbus county line through Green Swamp into Juniper Creek.
NCG07243,Honey Pot Swamp,Swamp,Wetlands,rises in central Gates County and flows S into Bennetts Creek.
NCG07244,Honeycut Cove,Valley,Landform,"near the N end of the Elk Mountains, central Buncombe County E of Jump Cove."
NCG07255,Hoods Pond,Pond,Water,E Wake County on Marks Creek.
NCG07269,Hooper Cove,Cove,Water,W Graham County between Cedar Top and Rattler Ford.
NCG07276,Hoot Owl Cove,Cove,Water,NW Jackson County on Shoal Creek.
NCG07278,Hootowl Hollow,Valley,Landform,SW Mitchell County parallel to Roaring Branch.
NCG07279,Hoots Millpond,Millpond,Water,E Wilkes County on Little Elkin River. Grain and sawmill operated there by the Hoots family.
NCG07286,Hope Valley Forest,Forest,Landform,"N Chatham and S Durham Counties, contained 1,735 acres. Est. in 1941 when the U.S. government conveyed a rehabilitation camp area to North Carolina State College. Now part of Jordan Lake public lands."
NCG07296,Horn Beam Swamp,Swamp,Wetlands,"rises in E Nash County and flows SE into Edgecombe County, where it enters Compass Creek."
NCG07297,Horn Camp Swamp,Swamp,Wetlands,rises in S Robeson County and flows SW into Ashpole Swamp.
NCG07300,Hornblower Point,Point,Landform,"S Chowan County, extends from E side of Edenton Bay into Albemarle Sound. A railroad bridge across the sound extends from the site to the mouth of Kendricks Creek in N Washington County. Now a part of Edenton Naval Air Station property. Shown as Moseleys Point on the Collet map, 1770; as Hornblow's Point on the MacRae map, 1833; and as Skinner's Point on the Price map, 1808, and on the Kerr map, 1882. Named for the Horniblow family, which owned property there."
NCG07305,Hornes Bay,Bay,Water,a sand-filled bay in W Columbus County. See Carolina Bays.
NCG07307,Hornet Swamp,Swamp,Wetlands,rises in W Sampson County and flows W into Little Coharie Creek.
NCG07315,Horse Cove,Cove,Water,"N Transylvania County, extends NE from Cat Pen Gap to Davidson River."
NCG07325,Horse Island,Island,Landform,"a long, narrow tidal-marsh island SE of Beaufort in S Carteret County."
NCG07329,Horse Pen Bay,Swamp,Wetlands,swamp in NW Brunswick County. A part of Green Swamp.
NCG07334,Horse Pen Swamp,Swamp,Wetlands,"rises in SW Bladen County and flows W into Robeson County, where it enters Big Swamp."
NCG07342,Horse Swamp,Swamp,Wetlands,rises in S Robeson County and flows SW into Aaron Swamp.
NCG07343,Horse Swamp Pocosin,Pocosin,Wetlands,E Onslow County between Queens Creek and Little Northeast Creek.
NCG07350,Horselot Cove,Cove,Water,"central Clay County, S of Evans Ridge."
NCG07352,Horsepen Bay,Pocosin,Wetlands,"a small pocosin near the head of Horse Branch, which see, N Pender County."
NCG07355,Horsepen Pocosin,Pocosin,Wetlands,a sandy pocosin in SW Gates County. Alt. 28.
NCG07356,Horsepen Point,Point,Landform,"SE Carteret County, extends from Core Banks into Core Sound."
NCG07357,Horsepen Point,Point,Landform,"on Ocracoke Island near the community of Ocracoke, SE Hyde County."
NCG07358,Horsepen Swamp,Swamp,Wetlands,rises in W Pitt County and flows SE into Swift Creek.
NCG07367,Horseway Swamp,Swamp,Wetlands,"rises in E Pitt County and flows NE into Beaufort County, where it enters Chicod Creek."
NCG07368,Horton Bay,Bay,Water,N central Carteret County behind Horton Point near the mouth of South River.
NCG07373,Horton Point,Point,Landform,N central Carteret County on E shore of South River near its mouth.
NCG07393,House's Mill Pond,Pond,Water,N Sampson County on Seven-mile Swamp. A mill est. there in 1812 by William House still grinds corn.
NCG07407,Howard Swamp,Swamp,Wetlands,rises in S Robeson County and flows SW into Indian Swamp.
NCG07410,Howards Bay,Bay,Water,S Onslow County in New River between Cedar Point and Sulliers Bay.
NCG07415,Howell Swamp,Swamp,Wetlands,"rises in N Greene County and flows SW into Beaman Run. Named for the Howell family, who were living in the vicinity as early as 1769."
NCG07416,Howells Point,Point,Landform,a small neck of land on the E side of Lockwoods Folly River just N of the channel of the Intracoastal Waterway in S Brunswick County.
NCG07418,Howes Point,Point,Landform,"E New Hanover County, extends from the mainland into the N waters of Middle Sound."
NCG07447,Huff Island,Island,Landform,"a sandy island approx. ½ mi. long in French Broad River, W Madison County."
NCG07450,Huggins Bay,Bay,Water,a loam-filled bay in SW Columbus County. See also Carolina Bays.
NCG07454,Huggins Island,Island,Landform,"E Onslow County between Dudley's Island and Swansboro in White Oak River. Named for Luke Huggins. Appears as Stones Island on the Moseley map, 1733. A fort or battery erected there by Confederate forces was designed to protect Bogue Inlet and West Channel from the Union fleet; it was destroyed in 1862."
NCG07466,Huitt Bay,Swamp,Wetlands,swamp in S central Brunswick County; a part of Green Swamp.
NCG07487,Hunters Millpond,Millpond,Water,"built prior to 1720 at the junction of Raynor Swamp and Harrell Swamp at the head of Bennetts Creek, E Gates County. Was destroyed about 1922 when a new highway was built. It was about 1 mi. long. Known in later years as Cross Millpond."
NCG07492,Hunting Island,Island,Landform,"in Bogue Sound, SW Carteret County."
NCG07495,Hunting Quarter Sound,Sound,Water,"appears on the Moseley map, 1733, as the water now forming the N end of Core Sound in NE Carteret County. Four small islands extending SE from the present Hog Island separated the sound from Pamlico Sound. Three of the four islands were named Chainshot, Harbour, and Shell."
NCG07515,Hurricane Cove,Cove,Water,E Graham County on the headwaters of Panther Creek.
NCG07533,Hyatt Cove,Cove,Water,NW Jackson County at the head of Shoal Creek.
NCG07542,Hyde Islands,Islands,Landform,formerly two islands with a total of 10 acres in Little Tennessee River in NE Graham County. Now under the waters of Fontana Lake.
NCG07563,Ike Cove,Cove,Water,S Haywood County on a tributary of Little East Fork Pigeon River.
NCG07567,Improvement Cove,Cove,Water,E Swain County between Middle Ridge and Connelly Mountain on Improvement Creek.
NCG07574,Indian Camp Bay,Bay,Water,"an arm of Big Colly Bay, NE Bladen County."
NCG07589,Indian Island,Island,Landform,"approx. 500 acres of arable land in North River Pocosin, SE Camden County, bounded on the E by North River. Island formerly was home to a thickly settled community, but it is now abandoned. Named for the large number of Indian artifacts that have been found there."
NCG07597,Indian Swamp,Swamp,Wetlands,rises on the Tyrrell-Washington county line and flows N into Banton Creek.
NCG07602,Indian Well Swamp,Swamp,Wetlands,rises in S Pitt County and flows SE into Clayroot Swamp.
NCG07611,Ingles Cove,Cove,Water,N Buncombe County N of Ingles Gap.
NCG07670,Isaac Hollow,Valley,Landform,"W Watauga County, extends SE N of George Gap Branch."
NCG07672,Isaac Walton Lake,Lake,Water,"formerly Water Works Lake, in W Person County on Storys Creek at the mouth of Satterfield Creek. Formed prior to 1928. Covers 213 acres; max. depth 25 ft. Owned by the town of Roxboro."
NCG07678,Island Branch Swamp,Swamp,Wetlands,connects Resolution Branch to Musselshell Creek in NW Jones County.
NCG07687,Island Swamp,Swamp,Wetlands,rises in E Pitt County and flows NE into Chicod Creek.
NCG07698,Ivory Swamp,Swamp,Wetlands,"rises in N Wayne County and flows NE into Wilson County, where it enters Contentnea Creek."
NCG07707,Ivy Swamp,Swamp,Wetlands,"rises in NE Wayne County and flows NE into Wilson County, where it enters Contentnea Creek. Named for the Ivey family, early settlers."
NCG07713,Jack Cove,Cove,Water,"NW Jackson County, formerly Schuler Cove. In 1956, on a 5,000-acre tract there, R. H. Kress est. the Jack Kress School and renamed Schuler Cove in honor of his late son. Operated as a trade school, there is a model farm and nursery; classes in forestry and various trades are conducted."
NCG07716,Jack Island Swamp,Swamp,Wetlands,W Duplin County on Nahunga Creek.
NCG07719,Jack Swamp,Swamp,Wetlands,"flourished as a community on the stream of that name in N Northampton County from about 1775, when a Quaker meetinghouse was built there, until about 1812, by which time most of the people had moved to central North Carolina and to Ohio."
NCG07723,Jacket Swamp,Swamp,Wetlands,rises in W central Halifax County and flows SE into Burnt Coat Swamp.
NCG07728,Jacks Bay,Bay,Water,NE Carteret County on E side of Piney Island and adjacent to Long Bay.
NCG07735,Jacks Swamp,Swamp,Wetlands,"rises in N Northampton County and flows NE into Virginia, where it enters Fountains Creek. Appears on the map of the North Carolina-Virginia line run by William Byrd and others, 1728."
NCG07749,Jackson Swamp,Swamp,Wetlands,rises in E Robeson County and flows E into Big Swamp.
NCG07754,Jacksons Pond,Pond,Water,on Cypress Creek in E Franklin County. Formed 1885. Covers 65 acres; max. depth 20 ft.
NCG07761,Jacob Swamp,Swamp,Wetlands,rises in central Robeson County and flows SE into Weatherspoon Cooling Pond. Approx. 7 mi. long.
NCG07766,Jacobs Swamp,Swamp,Wetlands,rises in S Nash County and flows SE into Tar River.
NCG07772,Jake Hollow,Valley,Landform,W Mitchell County on a tributary of Pigeonroost Creek.
NCG07796,Jarrett Bay,Bay,Water,"extends into the mainland of E Carteret County from Core Sound. It appears as Jarrets Creek on the Moseley map, 1733. Named for the Jarratt family."
NCG07798,Jarrett Hollow,Valley,Landform,"N Mitchell County, through which an unnamed tributary of Right Fork Bean Creek flows."
NCG07801,Jarrett's Point,Point,Landform,"S Onslow County, extends into New River. Named for John Jarratt. Now within the limits of Camp Lejeune Marine Base."
NCG07815,Jaynes Cove,Cove,Water,central Haywood County on a tributary of Jonathans Creek.
NCG07823,Jenkins Cove,Cove,Water,E Currituck County off the W side of Currituck Banks in Currituck Sound.
NCG07826,Jenkins Swamp,Swamp,Wetlands,rises in N Onslow County and flows S into Cowhorn Swamp.
NCG07841,Jerome Bog,Pocosin,Wetlands,"a pocosin on the Bladen-Cumberland county line E of the community of Jerome. An almost perfect elliptical shape with its long axis running NW-SE, it is an ancient lake now filled with peat. See also Carolina Bays."
NCG07867,Jews Quarter Island,Island,Landform,"a peninsula approx. 2½ mi. long extending into the S waters of Currituck Sound from the mainland, SE Currituck County. Presently owned by the Chatham family and used as a hunting lodge. Appears as Deuces Quarters on early maps. Today known as Dews Island and operates as a hunting club."
NCG07886,Joe Cove,Valley,Landform,valley in central Clay County through which Perry Creek flows.
NCG07894,Joel Cove,Cove,Water,E Clay County between Fishprong Branch and Buck Creek.
NCG07917,John West Cove,Cove,Water,in NE Cherokee County. Named for an early settler who lived in the cove.
NCG07922,Johns Cove,Cove,Water,NW Swain County between Twentymile Creek and Twentymile Ridge.
NCG07925,Johns Millpond,Millpond,Water,SE Scotland County on Leiths Creek. Formed 1840. Covers 150 acres; max. depth 15 ft.
NCG07928,Johns Swamp,Swamp,Wetlands,rises in SE Bladen County and flows S into Colly Creek.
NCG07930,Johnson Cove,Cove,Water,E central Yancey County between Bowlens Creek and George Fork. Said to have been named for a yodeler who walked through the region yodeling.
NCG07942,Johnsons Island,Island,Landform,NE Currituck County off Currituck Banks.
NCG07946,Johnsons Pond,Pond,Water,S Wake County on Terrible Creek.
NCG07951,Johnston Swamp,Swamp,Wetlands,rises in S Johnston County and flows NE into Stone Creek.
NCG07967,Jones Bay,Bay,Water,NE Pamlico County in Pamlico Sound on the S side of Goose Creek Island. See also Hobucken.
NCG07972,Jones Cove,Cove,Water,central Macon County at the head of Jacob Branch.
NCG07979,Jones Lake,Lake,Water,"central Bladen County, one of the Carolina Bays, which see. Covers 224 acres; max. depth 8.7 ft. It is part of Jones Lake State Park. Fishing, swimming, and boating. Known earlier as Woodwards Lake for Samuel Woodward, a local justice of the peace in 1734. Probably named for Isaac Jones, who later owned adjacent property."
NCG07984,Jones Pond,Pond,Water,SE Scotland County on Bridge Creek. Formed about 1810. Covers 75 acres; max. depth 8 ft.
NCG07986,Jones Swamp,Swamp,Wetlands,rises in W Sampson County and flows SW into South River.
NCG07997,Jordan Island,Island,Landform,in E Pasquotank County in Newbegun Creek near the community of Weeksville.
NCG07998,Jordan Lake,Lake,Water,"reservoir in Durham, Wake, and Chatham Counties. The 13,900-acre lake was created by the U.S. Corps of Engineers. Authorized 1963; construction began 1967. Name changed from New Hope Lake to B. Everett Jordan Dam and Lake in 1973 to honor former U.S. senator B. Everett Jordan. Built for recreation, water supply, and flood control."
NCG08003,Jordans Mill Pond,Pond,Water,"N Northampton County on Cypress Creek. Ivy Creek also flows into Jordans Mill Pond. Covers approx. 135 acres, with a max. depth of 12 ft. Named for an early owner."
NCG08007,Joshua Lake,Lake,Water,on Gerren Creek in S Transylvania County. Covers 60 acres and has a max. depth of 70 ft.
NCG08013,Joyce Kilmer Memorial Forest,Forest,Landform,"W Graham County in Nantahala National Forest, was dedicated to poet Joyce Kilmer (1886-1918), author of Trees and Other Poems, on July 30, 1936. It contains 3,840 acres of virgin forest (including poplar, hemlock, and oak) and is one of the finest stands of its type in America. Little Santeetlah Creek flows through the forest."
NCG08027,Judith Island,Peninsula,Landform,peninsula on Bell Island in S Hyde County. See also Abigails Islands.
NCG08030,Judson Lake,Lake,Water,"S Transylvania County, drains N into Little River. Covers 8 acres and has a max. depth of 20 ft."
NCG08043,Jump Cove,Cove,Water,N Buncombe County E of Iron Ore Ridge.
NCG08053,Jumping Swamp,Swamp,Wetlands,rises in S Columbus County and flows NE and E into Grissett Swamp.
NCG08065,Juniper Bay,Bay,Water,"S Hyde County in Pamlico Sound E of Marsh Island. Appears as New Mattamuskeet Creek on the Moseley map, 1733. See also Cecils Harbor."
NCG08070,Juniper Swamp,Swamp,Wetlands,rises in W Beaufort County and flows W to join Harding Swamp in forming East Branch Chicod Creek.
NCG08071,Juniper Swamp,Swamp,Wetlands,"rises in SW Onslow County and flows NW into Pender County, where it enters Shaking Creek."
NCG08084,Kaiser Lake,Lake,Water,S Transylvania County at the head of Morgan Mill Creek. Covers 2 acres and has a max. depth of 20 ft.
NCG08091,Kanuga Lake,Lake,Water,"central Henderson County on Little Mud Creek. Formed about 1908. Covers 12 acres; max. depth 20 ft. Summer camp owned by the Episcopal Church. Named for prehistoric Cherokee town Ka-nu-ga, on the West Fork of Pigeon River in Haywood County. The Indian name traditionally meant ""Meeting Place of Many Peoples."""
NCG08120,Keg Island,Island,Landform,"in the Cape Fear River, W New Hanover County SE of Campbell Island."
NCG08123,Kehukee Swamp,Swamp,Wetlands,"rises in E Halifax County and flows SW into Roanoke River. Appears as Kehukee Creek on the Collet map, 1770."
NCG08125,Keiths Bay,Bay,Water,sand-filled bay in S Sampson County on the head of Keiths Swamp. See also Carolina Bays.
NCG08126,Keiths Swamp,Swamp,Wetlands,rises in S Sampson County and flows SE into Black River.
NCG08133,Kelly Cove,Cove,Water,N Macon County on a tributary of Burningtown Creek.
NCG08138,Kellys Pond,Pond,Water,on Southwest Creek in E Lenoir County. Formed in or prior to 1738 by a man named Marshall. Covers 312 acres; max. depth 10 ft.
NCG08147,Kenan Pocosin,Pocosin,Wetlands,a large swamp in S Duplin County that is drained by ditches into Northeast Cape Fear River.
NCG08179,Kerr Lake,Lake,Water,"was formed in 1952 with the completion of John H. Kerr Dam on Roanoke River in Virginia. Reservoir also fed by Dan River, Nutbush Creek, Island Creek, and many smaller tributaries, it extends into central Vance County, N Granville County, and NW Warren County. Normally it covers 48,900 acres and is 39 mi. long, with a shoreline of 800 mi. Max. depth 99 ft. Used for hydroelectric power generation, flood control, municipal water supply, irrigation, and recreation. Named for Congressman John H. Kerr (1873-1958). Initially known as Buggs Island Lake for an island in Roanoke River below the dam. The section of the reservoir extending into Vance County on Nutbush Creek is sometimes known as Townsville Lake. The official name is John H. Kerr Reservoir."
NCG08194,Kilby Cove,Cove,Water,S Cherokee County. An unnamed stream flowing through the cove forms the headwaters of the E fork of Cook Creek.
NCG08205,Kill Swamp,Swamp,Wetlands,rises in N Sampson County and flows SW into Great Coharie Creek.
NCG08206,Kill'em Swamp,Swamp,Wetlands,rises in SE Hertford County and flows NW into Chinkapin Creek.
NCG08218,Kimsey Cove,Cove,Water,W Macon County at the head of Gibby Branch.
NCG08238,Kings Island,Island,Landform,"S Dare County in the waters of Pamlico Sound off Brooks Point, Hatteras Island."
NCG08242,Kings Point,Peninsula,Landform,peninsula extending from the mainland of NE Carteret County into Brett Bay.
NCG08276,Kit Swamp,Swamp,Wetlands,rises in N Craven County and flows SW into Little Swift Creek.
NCG08288,Kitty Hawk Bay,Bay,Water,"NE Dare County at the E end of Albemarle Sound, which see. Bounded on the N by the S extremity of North Banks and on the S by Colington Island."
NCG08304,Knotts Island,Island,Landform,"a peninsula in N Currituck County approx. 5 by 3½ mi.; extends into North Carolina from Princess Anne County, Va. Knotts Island Channel on the E connects Currituck Sound with Back Bay (in Virginia); North Landing River on the W rises in Virginia and flows past Knott Island into Currituck Sound. Appears as Knot Isle on the Comberford map, 1657. Probably named for James Knott or a member of his family. Knott held land in S Virginia as early as 1642. See also Mackay Island."
NCG08314,Koonces Bay,Bay,Water,"on White Oak River, SW Carteret County between Wire Point and Balls Point. Named for the Koonce family."
NCG08341,Lake Adger,Lake,Water,"in N central Polk County on Green River. Built by Blue Ridge Power Company in 1925 and known as Turners Lake for nearby Turners Shoals. Duke Power Company bought the hydroelectric plant and water rights in 1927 and later renamed the lake, likely for John B. Adger, who was active in power development on Broad River in South Carolina. Covers 438 acres, with a max. depth of 86 ft. Used to generate hydroelectric power."
NCG08342,Lake Ashnoca,Lake,Water,"central Buncombe County on Ragsdale Creek. The property of the Asheville School, it covers 27 acres."
NCG08344,Lake Benson,Lake,Water,"in S Wake County on Swift Creek. Formed in 1925 and named Rands Mill Pond for owners. Later renamed for B. B. Benson, former Raleigh city councilman. Covers 490 acres and has max. depth of 19 ft. Enlarged in 1951. Used as reservoir and for fishing."
NCG08345,Lake Brandt,Lake,Water,an artificial lake in central Guilford County on Reedy Fork Creek. Max. depth 25 ft. Covers 400 acres. Formed in 1920 and named for former Greensboro mayor Leon J. Brandt (1874-1920). Municipal water supply for Greensboro and owned by the city.
NCG08346,Lake Burlington,Lake,Water,"central Alamance County on Stony Creek. Formed 1910; enlarged 1961. Source of water for the city of Burlington. Covers 750 acres; 7Â½ mi. long, with a 50 mi. shoreline. Fishing, boating. Known earlier as Stony Creek Lake."
NCG08347,Lake Charles,Lake,Water,"on Grassy Creek, SE Buncombe County."
NCG08348,Lake Cheoah,Lake,Water,"NW Graham and SW Swain Counties. Formed 1928 by Aluminum Company of America in damming Little Tennessee River. Covers 648 acres; max. depth 200 ft. Used for power, swimming, and boating. Alt. 1,276."
NCG08351,Lake Craig,Lake,Water,"on Swannanoa River in central Buncombe County near the E boundary of Asheville. The Asheville Recreation Park is located near the dam. Named for Governor Locke Craig (1860-1925), whose home was nearby. The lake covers approx. 55 acres. Was a source of water for the city of Asheville prior to about 1903."
NCG08354,Lake Devin,Lake,Water,"central Granville County on Hatcher's Run, was formed in 1954 as a source of water for the town of Oxford. Covers 100 acres; max. depth 40 ft. Named for former chief justice of the North Carolina Supreme Court, W. A. Devin, a resident of Oxford."
NCG08355,Lake Drain,Lake,Water,flows E from Singletary Lake in E Bladen County into Colly Creek.
NCG08356,Lake Eden,Lake,Water,"on a tributary of North Fork [Swannanoa River], E Buncombe County at the former site of Black Mountain College."
NCG08357,Lake Emory,Lake,Water,on Little Tennessee River in central Macon County. Covers 200 acres; max. depth 20 ft. Formed 1925. Used by Nantahala Power & Light Company to generate electricity.
NCG08358,Lake Fisher,Lake,Water,"NE Cabarrus County. Formed in 1946 by a dam on Cold Water Creek. Covers 277 acres; max. depth 30 ft. Named for L. A. Fisher, superintendent of Concord water and power department. Used for fishing and as a source of water for the city of Concord."
NCG08359,Lake Franklin,Lake,Water,E Anson County SE of Lilesville. Covers approx. 5 acres; max. depth 25 ft. Formed in 1908 when gravel was removed from the site. Named for the owner of the property from which the gravel was dug.
NCG08360,Lake Gaston,Lake,Water,"was formed on Roanoke River about 8 mi. upstream from the city of Roanoke Rapids and extends along the Halifax-Northampton county line NW into NE Warren County and into Virginia. Gaston Dam, 3,600 ft. wide and 105 ft. high, was completed in 1963 by Virginia Electric and Power Company and lies on the upstream end of the Roanoke Rapids Lake. Lake Gaston is 34 mi. long, with max. width of 1.3 mi. Covers 20,300 acres, with a shoreline of 350 mi. and a max. depth of 97 ft. Used for generation of hydroelectric power and recreation."
NCG08361,Lake Gresham,Lake,Water,in N central Wake County on Perry Creek. Formed in 1939. Covers 100 acres and has max. depth of 30 ft. Used for recreation.
