ID,Label,Feature type,Meta-Category,Description
NCG03410,Concord Lake,Lake,Water,"N Cabarrus County on the E edge of Kannapolis. Formed in 1926 by a dam on Patterson Branch. Covers 85 acres, with a max. depth of 25 ft. Owned by the city of Concord and used for fishing and as a municipal water source."
NCG03423,Confederate Memorial Forest,Forest,Landform,"in Pisgah National Forest along the Haywood-Transylvania county line on the West Fork Pigeon River and the Blue Ridge Parkway. Dedicated July 12, 1942. Sponsored by the N.C. United Daughters of the Confederacy, the forest contains 125 acres planted with 125,000 red spruce and balsam trees."
NCG03429,Conine Island,Island,Landform,"S Bertie County, formed in a bend of the Roanoke River by Conine Creek, which cuts across a neck formed by the river. Appears as Caroline Island on the Collet map, 1770. See also Purchace Islands."
NCG03435,Connaritsa Pocosin,Pocosin,Wetlands,NW Bertie County.
NCG03436,Connaritsa Swamp,Swamp,Wetlands,rises in NW Bertie County in Connaritsa Pocosin and flows SE into Cashie River.
NCG03446,Conoconnara Swamp,Swamp,Wetlands,"rises in central Halifax County and flows NE into Roanoke River. It appears as Conoconary Creek on the Collet map, 1770. Conoconnara, the 2,500-acre plantation of Thomas Pollock Sr., was located there in 1721. Before the American Revolution, a Church of England chapel stood near the banks of the stream."
NCG03461,Contentnea Lake,Lake,Water,"central Wilson County on Contentnea Creek. Formed 1773. Covers 450 acres; max. depth 15 ft. First known as Cobb's Mill Pond (1773); later as Hadley's Mill Pond (named for Thomas Hadley), Barefoot's Mill Pond (1863), Wiggins Pond (1886), and David Daniel's Pond (1897). Acquired by Wilson Power and Light Co., 1904."
NCG03493,Coon Hollow,Valley,Landform,S Haywood County on a tributary of Middle Prong.
NCG03509,Coor Millpond,Millpond,Water,"W Wayne County on Beaverdam Swamp. A mill there was owned by Ollin Coor, sheriff of Wayne County in 1848."
NCG03510,Coot Cove,Cove,Water,W Swain County between the forks of Pilkey Creek.
NCG03528,Copper Swamp,Swamp,Wetlands,rises in E Martin County and flows W into Gardners Creek.
NCG03533,Coquina Beach,Beach,Landform,"part of Cape Hatteras National Seashore on S Bodie Island, E Dare County across from Bodie Island Lighthouse. Remains of shipwreck Laura A Barnes, grounded 1921, rest there."
NCG03539,Corapeake Swamp,Swamp,Wetlands,"rises in N Gates County and flows SE into Hamburg Ditch in the Dismal Swamp. Appears as Orapeak Creek on the Moseley map, 1733. The lower course of the stream is called Elm Swamp on the Moseley map but Loosen Swamp on the Collet map, 1770. Later maps, until as recently as 1929, use the name Orapeake Swamp."
NCG03547,Corduroy Swamp,Swamp,Wetlands,rises in N Northampton County and flows E and NE to join Rogers Swamp in forming Kirbys Creek.
NCG03549,Core Beach,Beach,Landform,"a portion of Core Banks, which see, in E Carteret County between Core Sound and the Atlantic Ocean. It lies just S of Portsmouth Island."
NCG03551,Core Point,Point,Landform,S side of Pamlico River central Beaufort County. Named for Coree Indians.
NCG03552,Core Sound,Sound,Water,"a body of water between the mainland and the Outer Banks extending from Cape Lookout to Pamlico Sound in E Carteret County. Named for the Coranine or Coree Indians who lived in the area. The name Corenines appears on the Comberford map, 1657. The Moll map, 1729, shows Coranine Sound; and the Moseley map, 1773, has Core Sound."
NCG03555,Corn Crib Point,Point,Landform,"SE Carteret County, extends into Jarrett Bay SE of the community of Davis."
NCG03558,Corncob Island,Island,Landform,"W Bogue Sound, SW Carteret County."
NCG03584,Cottage Point,Point,Landform,"E Pasquotank County, extends into the Pasquotank River within limits of Elizabeth City."
NCG03592,Cotton Patch Bay,Bay,Water,an arm of Big Colly Bay in NE Bladen County.
NCG03602,Council Mill Pond,Pond,Water,S Bladen County 14 mi. SE of county seat; an artificial pond on Friar Swamp owned by Clyde Council estate. Fishing. Not open to the public.
NCG03612,Court House Bay,Bay,Water,"S Onslow County in New River. The county's first courthouse was on the banks of New River there, 1734-35."
NCG03641,Cow Island,Island,Landform,"higher ground surrounded by swamp, S Duplin County."
NCG03643,Cow Swamp,Swamp,Wetlands,rises in S Pitt County and flows NE into Chicod Creek.
NCG03645,Cowan Cove,Valley,Landform,the valley through which the upper course of Smith Mill Creek flows in central Buncombe County.
NCG03650,Coward Lake,Lake,Water,formed in 1950 in central Jackson County on Norton Creek. Covers 1 acre and has max. depth of 10 ft. Used for fishing. Not open to the public.
NCG03666,Cowford Swamp,Swamp,Wetlands,rises in SW Robeson County and flows NE into Ashpole Swamp.
NCG03668,Cowhorn Swamp,Swamp,Wetlands,rises in N Onslow County and flows SW into New River.
NCG03669,Cowl Cove,Cove,Water,on a tributary of Clear Branch in SW Macon County.
NCG03672,Cowpen Island,Island,Landform,a point of land extending from Core Banks into Core Sound in SE Carteret County.
NCG03684,Cox Millpond,Millpond,Water,"on the Johnston-Wayne county line on Mill Branch, just before its confluence with Mill Creek. Named for an early Quaker family of Wayne County."
NCG03685,Cox Point,Point,Landform,extends from E Onslow County into White Oak River.
NCG03700,Crab Island,Island,Landform,"in swampy area of S Currituck County between Sligo and Shawboro. Used by local Confederates under Capt. Caleb Grandy. Target of Union troops under Gen. Edward Wild, 1863."
NCG03703,Crab Point,Point,Landform,a point of the mainland in central Carteret County extending into waters of Newport River.
NCG03704,Crab Point Bay,Bay,Water,"in Newport River, Carteret County, near mouth of Calico Creek N of Morehead City."
NCG03715,Craddock Swamp,Swamp,Wetlands,rises in N Sampson County and flows SW into Ward Swamp.
NCG03726,Craigs Point,Point,Landform,extends into the E side of Sulliers Bay in SE Onslow County.
NCG03733,Cranberry Island,Island,Landform,high ground in N Tyrrell County surrounded by peat lands N of community of Levels.
NCG03744,Cransford Cove,Cove,Water,W Macon County at the head of Wayah Creek.
NCG03758,Crawley Swamp,Swamp,Wetlands,"rises in W Bladen County and flows W into Robeson County, where it enters Big Swamp."
NCG03762,Creedmoor Lake,Lake,Water,SE Granville County on Ledge Creek. Formed in 1939 as a source of water for the town of Creedmoor and for recreation. Covers 100 acres. Also called Lake Rogers. Max. depth 30 ft.
NCG03767,Creeping Swamp,Swamp,Wetlands,"rises in SW Beaufort County and flows SW into Clayroot Swamp. For a part of its course, it forms the Beaufort-Pitt and Craven-Pitt county lines."
NCG03779,Cricket Swamp,Swamp,Wetlands,"rises in E central Bertie County and flows S into Eastmont Swamp. Probably named for John Crickett, who owned land in the area as early as 1729."
NCG03789,Croatan National Forest,Forest,Landform,"in parts of Carteret, Craven, and Jones Counties. Est. 1933. Covers 294,610 acres. Includes the Croatan Cooperative Wildlife Management Area. Headquarters are in New Bern."
NCG03790,Croatan Sound,Sound,Water,"connects Albemarle and Pamlico Sounds between Roanoke Island and the mainland of Dare County. Appears as The Narrows on the Moseley map, 1733. Virginia Dare Memorial Bridge, opened 2002 and 5 mi. in length, spans the sound to connect Roanoke Island to Manns Harbor."
NCG03792,Croatoan Island,Islands,Landform,"a name applied by John White on his map of 1585 to the S portion of Hatteras Island (Dare County) and a portion of Ocracoke Island (Hyde County). Hatteras Inlet, now dividing this portion of the Outer Banks into two islands, was opened in 1846. Ralph Lane, governor of the first Roanoke colony, named the island ""My Lord Admirals Iland"" in honor of Lord Howard of Effingham, created Lord High Admiral in 1585. By 1657 Comberford showed the island as ""Chowanoke."" Smith, in 1624, had called it Abbots Island. The name Croatoan was derived from the Indian village that was on the present Cape Hatteras (Kro-otÃ¤n [talk town], indicating the chief's residence.) See also Portsmouth Island."
NCG03806,Crooked Swamp,Swamp,Wetlands,rises in N Nash County and flows SE then NE into Fishing Creek.
NCG03821,Cross Swamp,Swamp,Wetlands,rises in E Columbus County and flows SE into Waccamaw River.
NCG03831,Crow Island,Island,Landform,"appears on the Collet map, 1770; it existed as late as 1833. In Currituck Sound, NE Currituck County, it was SE of Knotts Island and barred the sound side of New Currituck Inlet until the inlet closed. After 1833 Crow Island began disintegrating, so that by 1861 it was only a mass of tidal-marsh islands."
NCG03848,Crystal Lake,Lake,Water,"E Moore County on Shaddock's Creek at the community of Lakeview. Formed in 1855 when Duncan Blue constructed a dam there; enlarged about 1908. Covers approx. 100 acres. Used for fishing, swimming, and boating."
NCG03855,Cucklemaker Swamp,Swamp,Wetlands,rises in N central Bertie County and flows S into Hoggard Mill Creek.
NCG03903,Currituck Point,Point,Landform,extends from the SW mainland of Hyde County into the mouth of Pungo River.
NCG03904,Currituck Sound,Sound,Water,"the body of water between Currituck Banks on the E and the mainland of Currituck County on the W and from Knotts Island on the N to Powells Point on the s. Approx. 30 mi. long; max. width, 4 mi. It appears on the Moseley map, 1733. In 1930 Wright Memorial Bridge, 3 mi. long wooden span, was built across the sound from Point Harbor to N of Kitty Hawk. See also Titepano."
NCG03907,Curtis Cove,Cove,Water,S Haywood County. A tributary of West Fork Pigeon River flows through the cove.
NCG03916,Cutawhiskie Swamp,Swamp,Wetlands,"rises in SE Northampton County and flows NE into Hertford County, where it enters Livermans Mill Pond on Potecasi Creek. Named for an Indian village mentioned in local records (with various spellings) as early as 1718."
NCG03917,Cutoff Island,Island,Landform,"E Dare County, in the waters of Roanoke Sound off the SW tip of Bodie Island."
NCG03921,Cuwhiffle Swamp,Swamp,Wetlands,"rises in SE Sampson County near Delway and flows NW into Six Runs Creek. The name may be derived through faulty pronunciation of the Gaelic Culmhutar (pronounced ""kul-vú-tar""), meaning ""smuggler"" or ""mutineer."" See also Quewhiffle."
NCG03928,Cypress Creek Bay,Bay,Water,"a mucky, loam-filled bay in central Columbus County."
NCG03931,Cypress Point,Point,Landform,a point of land extending from the mainland of W Dare County S of Mill Tail Creek into Alligator River.
NCG03962,Dan Weeks Point,Point,Landform,"a point of land extending into White Oak River, SW Carteret County."
NCG03977,Daniels Cove,Cove,Water,S Haywood County on Shining Creek.
NCG03996,Dark Cove,Valley,Landform,extends NW from Big Butte Mountain to West Cove in E Haywood County.
NCG04018,Davids Point,Point,Landform,"an arm of N Hatteras Island extending into Pamlico Sound, E Dare County. Lies E of Great Island and S of the community of Waves."
NCG04037,Davis Bay,Bay,Water,E Pasquotank County between Cobb Point and Brickhouse Point on the Pasquotank River.
NCG04043,Davis Island,Island,Landform,"in Core Sound at the S end of Davis Shore, E Carteret County. Named for William Davis, who settled there in 1715."
NCG04045,Davis Mill Pond,Pond,Water,"on Trotters Creek, W Lenoir County. Formed about 1850. Covers 60 acres; max. depth 12 ft."
NCG04078,Dean Island,Island,Landform,a sandy island approx. ½ mi. long in Little Tennessee River in N Macon County.
NCG04083,Deavers Mill Pond,Pond,Water,on Poley Swamp in N Duplin County. Alt. 106.
NCG04084,DeBerry's Mill Pond,Pond,Water,NE Northampton County on Kirbys Creek. Covers approx. 100 acres; max. depth 10 ft.
NCG04088,Deep Bay,Bay,Water,"a bay on the SE shore of South Lake, central Dare County."
NCG04092,Deep Cove,Cove,Water,"a channel separating Judith Island and Swanquarter Island in Pamlico Sound, S Hyde County."
NCG04105,Deep Gap Cove,Cove,Water,S Haywood County on a tributary of Little East Fork Pigeon River.
NCG04112,Deep Point,Point,Landform,"point of land extending into Alligator River, E of junction of Intracoastal Waterway and Alligator River, N Hyde County."
NCG04116,Deep Run Swamp,Swamp,Wetlands,rises in E Martin County and flows NW into Gardners Creek.
NCG04118,Deep Water Point,Point,Landform,"appears on the Moseley map, 1733, in what is now Brunswick County between Elizabeth River and Walden Creek, E of the present town of Southport. Appeared as late as 1851-53 on navigation charts. See also Walkersburg."
NCG04124,Deer Island,Island,Landform,SE Onslow County W of Swansboro in the mouth of Hawkins Slough. Formerly 3 acres but now considerably reduced. The name is now applied to the nearby peninsula between Swansboro and The Hammock.
NCG04140,Del Mar Beach,Beach,Landform,SE Pender County on the Atlantic Ocean side of Topsail Island.
NCG04147,Dellinger Hollow,Valley,Landform,in E Mitchell County between Long Ridge and the Avery-Mitchell county line.
NCG04154,DeLoatche's Mill Pond,Pond,Water,central Northampton County on Potecasi Creek.
NCG04171,Denniss Island,Island,Landform,"formerly an island in present Currituck Banks, E Currituck County. It was separated from Currituck Banks by Currituck Inlet on the N and Musketo Inlet on the s, both of which are now closed. Shown on Comberford map, 1657. See also Currituck Inlet; Musketo Inlet."
NCG04187,"Desert, The",Pocosin,Wetlands,"a pocosin in N Robeson County between Big Raft Swamp and Big Marsh Swamp. Oval shaped and presumed to be one of the Carolina Bays, which see. Covers 1,200 acres; water depth varies from 6 in. to 4 ft. Game abounds there, especially deer."
NCG04190,Deserter Island,Island,Landform,a land formation in S Duplin County surrounded by swamp.
NCG04201,Devil's Kitchin,Pocosin,Wetlands,pocosin in N Pender County adjacent to Stag Park tract.
NCG04243,Dick Cove,Cove,Water,central Cherokee County at the headwaters of Dick Branch.
NCG04290,Dismal Bay,Bay,Water,sand-filled bay in S Sampson County N of Keiths Bay. See also Carolina Bays.
NCG04292,Dismal Cove,Cove,Water,SW Macon County at the head of Pat Stable Branch.
NCG04295,Dismal Swamp,Swamp,Wetlands,"marsh, lake, and cypress-filled area approx. 30 mi. long and 10 mi. wide, largely in SE Virginia but partially in Gates, Pasquotank, Camden, and Currituck Counties. Appears on the Dudley map, 1647, as ""Terra Bassa"" (low land) and on the Comberford map, 1657, as ""a swampy wilderness."" Present name might have been known as early as 1715, when the term ""dismal swamp"" was applied to the Pasquotank County area by John Talbot in a letter to John Urmston, a missionary to the colony for the Society for the Propagation of the Gospel. Shown on the Moseley map, 1733, as Great Dismal Swamp (the name it is sometimes called today) and as Dismal Swamp on the Mitchell map, 1755. George Washington initiated surveys in 1763 for a canal. The Intracoastal Waterway now passes through the swamp. Also called The Desert in North Carolina."
NCG04314,Dixon Point,Point,Landform,"S Onslow County, extends into Stump Sound from the mainland."
NCG04319,Dobbins Mill Pond,Pond,Water,"central Yadkin County on North Deep Creek, covers approx. 25 acres. Max. depth 30 ft. Formed 1936 by Nelson Dobbins. Used for fishing, boating, irrigation, waterskiing."
NCG04355,Dog Cove,Cove,Water,E Swain County on the head of Wesser Creek between Middle Ridge and Odear Cove.
NCG04358,Dog Island,Islands,Landform,"formerly a single island in Bogue Sound near Bogue Banks, S Carteret County. Appears on the Moseley map, 1733. Now three small islands."
NCG04384,Doolittle Mill Pond,Pond,Water,N Northampton County on Paddys Delight Creek. Covers approx. 75 acres. Max. depth 10 ft.
NCG04388,Dora's Island,Island,Landform,SE Onslow County in the mouth of Queens Creek.
NCG04444,Dowry Island,Island,Landform,about ¼ mi. long in Chowan River on the Gates-Hertford county line.
NCG04449,Dram Tree Point,Point,Landform,"extends from Eagles Island, W New Hanover County, into Cape Fear River. Named for an old moss-covered cypress tree that stood there; it is said that outgoing mariners, in passing the point, had a drink to the success of their voyage. To those inward bound, it was a welcome signal that port was near."
NCG04462,Drowned Bay,Swamp,Wetlands,"mucky swamp, SW Brunswick County."
NCG04472,Drum Point,Point,Landform,point on mainland of NE Carteret County extending into mouth of Nelson Bay.
NCG04474,Drummond's Point,Point,Landform,"SE tip of Chowan County extending into the mouth of Yeopim River. Named before 1700 for William Drummond (d. 1677), first governor of Albemarle under the Lords Proprietors. Appears on the Moseley map, 1733. Site of one of the largest early seine fisheries on Albemarle Sound."
NCG04487,Dry Lake,Lake,Water,NE Surry County. Formed in 1937 by the construction of a dam across a dry hollow into which a small unnamed stream was diverted. Covers approx. 8 acres; max. depth 15 ft. Municipal water supply for Mount Airy.
NCG04489,Dry Pocosin,Pocosin,Wetlands,a muck-filled pocosin in E Duplin County.
NCG04510,Duck Island,Island,Landform,in Roanoke Sound at the S end of Bodie Island in E Dare County.
NCG04512,Duck Pond Swamp,Pocosin,Wetlands,"pocosin in E central Cumberland County drained by Reese Creek. One of the Carolina Bays, which see."
NCG04522,Dudley's Island,Island,Landform,E Onslow County in the mouth of White Oak River at Bogue Inlet.
NCG04527,Duges Island,Island,Landform,E Carteret County in Core Sound near Core Banks.
NCG04532,Duke Forest,Forest,Landform,"W Durham and E Orange Counties, consists of a total of 7,020 acres in 5 main units. Est. 1931, it is owned by Duke University and used for demonstration, an experimental forest, and an outdoor laboratory for students in forestry. There are recreational areas and provisions for picnickers, hikers, and horseback riders."
NCG04535,Duke Swamp,Swamp,Wetlands,rises in N Gates County and flows S to join Raynor Swamp and Harrell Swamp in forming Bennetts Creek.
NCG04563,Dunn Swamp,Swamp,Wetlands,rises in NW Columbus County and flows NW into Porter Swamp.
NCG04570,Dunsmore Cove,Valley,Landform,"valley of Dunsmore Cove Branch, SE Buncombe County near Ridgecrest."
NCG04577,Durant Island,Island,Landform,"N Dare County in Albemarle Sound; about 5 m. long from E to W and 3 mi. N to S at the widest. Appears on the Moseley map, 1733."
NCG04578,Durant Point,Peninsula,Landform,"peninsula extending from the S part of Hatteras Island, S Dare County, into Pamlico Sound N of Sandy Bay."
NCG04592,Dutch Cove,Cove,Water,E Haywood County on the head of Dutch Cove Creek.
NCG04623,Eagle Rock Cove,Valley,Landform,"valley of Eagle Rock Creek, NE Buncombe County."
NCG04626,Eagle Swamp,Swamp,Wetlands,rises in N Lenoir County and flows SE into Contentnea Creek.
NCG04631,Eagles Island,Islands,Landform,"a group of swampy islands in W New Hanover County between Cape Fear and Brunswick Rivers opposite Wilmington. Named for Joseph and Richard Eagle, eighteenth-century settlers in the vicinity. See also Dram Tree Point. Appears as Cranes Island on the Ogilby map, 1671."
NCG04632,Eagleton Point,Point,Landform,"point of land extending NW from Colington Island into the waters of Kitty Hawk Bay, N Dare County. Also known as North Point and Eggleston Point."
NCG04643,Eason Millpond,Millpond,Water,W Pitt County on Kitten Creek.
NCG04646,East Bay,Bay,Water,"in N Piney Island E of Rattan Bay, NE Carteret County. Approx. ¾ mi. long and ½ mi. wide."
NCG04650,East Bluff Bay,Bay,Water,S Hyde County in Pamlico Sound E of Bluff Point.
NCG04656,East Dismal Swamp,Swamp,Wetlands,"a 20,000-acre area of peat and muck swamp extending NE from N Beaufort County across S and E Washington County into W Tyrrell County. See also Dogwood Ridge; New Lands."
NCG04668,East Fork Lake,Lake,Water,"in central Jackson County on Tuckasegee River. Formed in 1955 to be a reservoir for Nantahala Power and Light Company. Combines with Wolf Creek Lake, which see, to generate hydroelectric power. Covers 40 acres, with max. depth of 120 ft. Shoreline is 3.2 mi. Named for East Fork of Tuckasegee River, an old name for the Tuckasegee River."
NCG04691,East Lake,Lake,Water,"lake on the mainland of N Dare County, empties into the mouth of Alligator River."
NCG04727,Eastmost Swamp,Swamp,Wetlands,rises in E central Bertie County and flows S into Salmon Creek.
NCG04728,Eastmouth Bay,Bay,Water,in the waters of Core Sound between the two large islands comprising Harkers Island in SE Carteret County.
NCG04732,Eastwood Lake,Lake,Water,"S Orange County in NE Chapel Hill. Formed in 1937 by a dam on Booker Creek. Approx. ¾ mi. long, covering 58 acres, with a max. depth of about 20 ft. Now the center of a residential area."
NCG04751,Edenhouse Point,Point,Landform,"point of land extending into Chowan River, E Bertie County. Location of an early seine fishery."
NCG04754,Edenton Bay,Bay,Water,"S Chowan County in Albemarle Sound. Formed by the mouth of Pembroke Creek. Covers approx. 4,000 acres."
NCG04767,Edith Lake,Lake,Water,S Henderson County on Green River. Approx. 1½ mi. long.
NCG04775,Edward Cove,Cove,Water,S Haywood County on a tributary of Bird Creek.
NCG04783,Edwards Pocosin,Pocosin,Wetlands,S Northampton County between Lily Pond Creek and Quarter Swamp.
NCG04802,Ela Lake,Lake,Water,on Oconaluftee River in E Swain County. Covers 20 acres; max. depth 15 ft. Formed in 1925. Owned by the Aluminum Company of America and used to generate electric power. Formerly known as Onitalooga Lake.
NCG04868,Elkton Swamp,Swamp,Wetlands,rises in S Bladen County and flows S into Brown Marsh Swamp.
NCG04879,Eller Cove,Cove,Water,S Graham County between Horse Range Ridge and Atoah Gap.
NCG04880,Eller Cove,Valley,Landform,N Buncombe County between Little Davis and Lydie Mountains.
NCG04892,Elliott Cove,Cove,Water,N Swain County between Sunkota Ridge and Deep Creek.
NCG04897,Ellis Lake,Lake,Water,"a natural lake in Croatan National Forest, S Craven and N Carteret Counties. Covers 1,500 acres; max. depth 4 to 5 ft. Named for the Ellis family, which lived on its shores."
NCG04951,Enka Lake,Lake,Water,central Buncombe County on Bill Moore Creek. Covers 40 acres; max. depth 40 ft. Owned by American Enka Corp. as a source of water for rayon manufacturing. Formed 1928.
NCG04954,Ennetts Point,Point,Landform,"W Carteret County, extending into Bogue Sound W of the mouth of Deer Creek. Named for the Ennett family."
NCG04989,Eskridge Cove,Valley,Landform,the valley through which Eskridge Cove Branch flows in SE Buncombe County.
NCG05003,Etheridge Swamp,Swamp,Wetlands,receives the waters of Etheridge Creek on the Halifax-Edgecombe county line and flows SE into Conoho Creek in Martin County.
NCG05005,Ethram Boney Bay,Marsh,Wetlands,a large sandy loam marsh in S Duplin County.
NCG05009,Euchulla Cove,Cove,Water,W Swain County between Wiggins Creek and Nantahala River.
NCG05016,Eury Lake,Lake,Water,"central Montgomery County on Little River, approx. 8 mi. S of Troy. Constructed about 1914 by S. J. and W. G. Smitherman and J. C. Hurley to provide electric power. Covers 80 acres, with a shoreline of approx. 3 mi. Later owned by Carolina Power and Light Company but sold in 1962 to the Montgomery County Hunt Club, Inc. Known as Hurley Lake until 1916, when the present name came into use."
NCG05035,Everetts Mill Pond,Pond,Water,"in SW Richmond County on Marks Creek, approx. 1 mi. long."
NCG05037,Evergreen Island,Island,Landform,"Pamlico Sound just off the central section of Portsmouth Island, E Carteret County."
NCG05062,Fain Cove,Cove,Water,"E Cherokee County, through which a short tributary of Slow Creek flows."
NCG05072,Fairfield Lake,Lake,Water,"S Jackson County on Trays Island Creek formed in 1910. Covers 100 acres; max. depth 40 ft. Used for fishing, swimming, and boating and as a power source. Not open to the public. See also Fairfield Falls."
NCG05103,Falling Hollow,Valley,Landform,SW Watauga County on the head of Watauga River.
NCG05111,Falls Lake,Lake,Water,"was built by the U.S. Army Corps of Engineers by damming the Neuse River at the community of Falls in Wake County. Provides water supply, recreation, and flood control. Main body of 20 sq. mi. Lake is in Durham and Wake Counties."
NCG05125,Faraby Island,Island,Landform,"a narrow sandy loam island about 1 mi. long in the mouth of North Landing River, NE Currituck County. Sometimes called Ferebee's Island."
NCG05127,Farley Cove,Cove,Water,follows the SE course of a small stream flowing into Santeetlah Lake in W central Graham County.
NCG05140,Farnell Bay,Bay,Water,"central Onslow County, is formed by an indentation of the E bank of New River SE of Hadnot Point."
NCG05141,Farnell Point,Point,Landform,central Onslow County on the mouth of Wallace Creek.
NCG05145,Farrars Island,Island,Landform,"in the Cape Fear River at the junction of the Chatham, Harnett, and Lee county lines NW of Buckhorn Falls. Approx. 1½ mi. long. Mentioned as early as 1819 in a survey of the rivers of the state."
NCG05147,Fate Puett Cove,Cove,Water,E Cherokee County on the headwaters of Burl Branch SE of Indian Grave Gap.
NCG05162,Fed Cove,Cove,Water,on a tributary of Caler Fork in E Macon County.
NCG05164,Federal Point,Point,Landform,projects from the S tip of New Hanover County between Cape Fear River and the Atlantic Ocean.
NCG05203,Figure Eight Island,Island,Landform,E New Hanover and Pender Counties between Middle Sound and the Atlantic Ocean and extending from Mason Inlet on the S to Rich Inlet on the n. In 1965 work was begun to develop the island into a private gated resort community. A 260-foot causeway and a bridge over the Intracoastal Waterway connect it with the mainland.
