ID,Label,Feature type,Meta-Category,Description
NCG12039,Polecat Hollow,Valley,Landform,W Madison County on an unnamed tributary of French Broad River.
NCG12044,Poley Swamp,Swamp,Wetlands,rises in N Duplin County and flows N from Whitfields Pond into Deavers Mill Pond. Also known as Polly Run Creek.
NCG12052,Pollard Swamp,Swamp,Wetlands,rises in SW Beaufort County and flows SW into Creeping Swamp.
NCG12054,Pollock Swamp,Stream,Water,"a marshy stream, rises in Bear Swamp, E Chowan County, and flows SW into Pembroke Creek. Pollock Swamp watershed, approx. 17 mi. long, is in the area."
NCG12059,Polly Hollow,Valley,Landform,E Mitchell County parallel to Laurel Branch.
NCG12081,Pool Point,Point,Landform,extends from E Pasquotank County into Pasquotank River at the mouth of New Begun Creek.
NCG12096,Popes Pond,Pond,Water,"slightly less than ½ mi. long, on Black River, SE Harnett County."
NCG12100,Poplar Branch Bay,Bay,Water,"S central Currituck County, is formed in Currituck Sound by the mainland, Rattle Snake Island, and Long Point."
NCG12102,Poplar Cove,Cove,Water,S Swain County extends SW from Little Tennessee River.
NCG12113,Poplar Point,Point,Landform,"a bluff on the Roanoke River, N Martin County. Appears on the Collet map, 1770. A steamboat landing was there at one time; Poplar Point Church and a rural community are nearby. Roanoke, a post office, operated at or near the point, 1851-80."
NCG12122,Poquoson Point,Point,Landform,"S Camden County in the mouth of Pasquotank River. Also sometimes called Camden Point. Name derived from an Algonquian word pequessen, meaning a swamp or a dismal."
NCG12126,Porpoise Point,Point,Landform,NE Pamlico County on the E side of Goose Creek Island between Big Porpoise Bay and Little Porpoise Bay.
NCG12132,Porter Cove,Cove,Water,on a tributary of Cullasaja River in S Macon County.
NCG12134,Porter Swamp,Swamp,Wetlands,rises in W Columbus County and flows NW and SW into Lumber River.
NCG12142,Portsmouth Island,Island,Landform,"NE Carteret County, is the name applied to the NE end of Core Banks. Appears as Wococon, which see, on the White map, 1585. May have been a part of Croatoan Island. See also Portsmouth; Core Banks; Cape Lookout National Seashore Recreational Area."
NCG12146,Possum Hollow,Valley,Landform,S Haywood County on the E side of Bearpen Gap. An unnamed stream rises there and flows E into Haywood Gap Stream.
NCG12148,Possum Neck Swamp,Swamp,Wetlands,rises in S Craven County and flows NW into Brice Creek.
NCG12165,Potato Hill Lake,Lake,Water,artificial lake in central Watauga County on Howard Creek between Rich Mountain and Harmon Knob. Formed in 1947; max. depth 25 ft.; covers 9 acres. Open to public. Also known as Tater Hill Lake.
NCG12189,Pounding Mill Cove,Cove,Water,N Yancey County on Pounding Mill Creek.
NCG12203,Powells Pocosin,Pocosin,Wetlands,NW Bertie County.
NCG12204,Powells Point,Point,Landform,"tip of the peninsula of S Currituck County in Albemarle Sound. Appears in local records as early as 1665 and on the Ogilby map, 1671. The community (and post office, est. 1818) of Powells Point is 6½ mi. n."
NCG12220,Press Cove,Cove,Water,N Jackson County on the head of East Fork [Dicks Creek].
NCG12228,Pretty Pond,Pond,Water,"a natural lake in SE Brunswick County. Max. depth 8 ft. Surface area, 150 acres."
NCG12247,Prissy Bay,Bay,Water,sand-filled bay in SE Sampson County at the head of Wildcat Swamp. See also Carolina Bays.
NCG12251,Procks Point,Point,Landform,"extends into Jarrett Bay SE of community of Davis, SE Carteret County."
NCG12280,Puett Cove,Valley,Landform,NE Cherokee County in the Valley River Mountains.
NCG12304,Pungo Lake,Lake,Water,"natural lake in S Washington and NW Hyde Counties in East Dismal Swamp. Inaccessible except through private property; not open to the public. Owned by Roper Lumber Company. Covers 2,700 acres, with a max. depth of 5 ft. Name is shortened from name for the Machapunga Indians."
NCG12312,Purchace Islands,Islands,Landform,"the name given on the Smith map, 1624, to the nine islands in Roanoke and Cashie Rivers at the conjunction of Bertie, Martin, and Washington Counties. Apparently one of the islands is unnamed, but the other eight are known as Louse Island, Rice Island, Goodmans Island, Wood Island, Great Island, Huff Island, Conine Island, and Tabor Island. Smith is thought to have named the islands in honor of Samuel Purchas (1575?-1626), an English compiler of travel books."
NCG12316,Purgatory Pocosin,Pocosin,Wetlands,a sandy loam-filled pocosin in SW Jones and NW Onslow Counties at the head of Mill Swamp.
NCG12349,Quarter Swamp,Swamp,Wetlands,rises in central Northampton County and flows SE into Urahaw Swamp.
NCG12361,Queens Creek Lake,Lake,Water,"formed in 1948 on Queens Creek in NW Macon County. Covers 37 acres, with a max. depth of 68 ft. Owned by Nantahala Power and Light Company to generate electricity."
NCG12375,Quinine Swamp,Swamp,Wetlands,rises in NW Bertie County and flows SE into Roanoke River.
NCG12378,Quioccosin Swamp,Swamp,Wetlands,rises in N central Bertie County and flows NW into Stony Creek.
NCG12391,Raccoon Bay,Bay,Water,"in Currituck Sound off the W shore of Currituck Banks, E Currituck County."
NCG12398,Raccoon Swamp,Swamp,Wetlands,rises in SE Johnston County and flows S into Neuse River.
NCG12405,Radio Island,Island,Landform,"land mass between Morehead City and Beaufort, S Carteret County. Takes name from commercial radio station formerly operating on the island."
NCG12408,Raft Swamp,Swamp,Wetlands,"rises in S Hoke County and flows SE into central Robeson County, where it enters Lumber River. Much Tory activity during the Revolution was centered there, and the name is frequently mentioned in records of the time."
NCG12411,Ragged Point,Point,Landform,"central Onslow County, extends into N Morgan Bay."
NCG12416,Rail Cove,Cove,Water,NE Cherokee County at the head of Rail Cove Branch.
NCG12418,Railroad Pond,Pond,Water,E Anson County SE of Lilesville. Covers approx. 4 acres; max. depth 12 ft. Formed early in the twentieth century when gravel was removed from the site.
NCG12423,Rainbow Islands,Islands,Landform,"areas of fine, sandy loam surrounded by swamp in E Washington County SW of the community of Scuppernong."
NCG12424,Rainbow Lake,Lake,Water,in S Transylvania County on Middle Creek near its junction with East Fork French Broad River. Covers 2 acres and has a max. depth of 20 ft. Used for recreation.
NCG12431,Raleigh Bay,Bay,Water,in the Atlantic Ocean off the central coast of North Carolina from Cape Lookout on the S to Cape Hatteras on the N.
NCG12439,Ramp Cove,Valley,Landform,NE Cherokee County in the Valley River Mountains. Named because ramps grow abundantly there.
NCG12454,Randall Lake,Lake,Water,on Big Creek in SE Macon County.
NCG12475,Ratcliff Cove,Cove,Water,"central Haywood County, forms a semicircle on the head of a tributary of Raccoon Creek W of Ratcliff Mountain."
NCG12477,Rattan Bay,Bay,Water,"W Piney Island in NE Carteret County bounded by Neuse River and North, East, and South Bays. Approx. 1 mi. wide and ¾ mi. long."
NCG12481,Rattle Snake Island,Island,Landform,a small tidal-marsh island in Currituck Sound off the SE shore of the mainland of Currituck County.
NCG12491,Rattlesnake Pocosin,Pocosin,Wetlands,S Duplin County on Island Creek.
NCG12499,Raven Hollow,Valley,Landform,S Haywood County between Beartrap Knob and Beartrap Ridge.
NCG12501,Raven Knob Pond,Pond,Water,"NW Surry County on an unnamed tributary of Fisher River. Covers 15 acres; max. depth 20 ft. Formed in 1950. Fishing, boating, and swimming. Owned by Old Hickory Council, Boy Scouts of America."
NCG12509,Ravenel Lake,Lake,Water,"SE Macon County near the head of Cullasaja River 2 mi. NW of Highlands. Approx. 2 mi. long. The body of water is probably the Stewart's Pond visited by Bradford Torrey and described in the Atlantic Monthly, September 1897."
NCG12519,Ray Cove,Cove,Water,N Buncombe County between Ray Knob and Reems Creek.
NCG12523,Raymond Island,Island,Landform,"off of W side of Currituck Banks in Currituck Sound S of South Channel, NE Currituck County."
NCG12525,Rayner Millpond,Millpond,Water,W Wayne County on a tributary of Beaverdam Creek.
NCG12528,Raynor Pond,Pond,Water,on Mingo Swamp in SW Johnston County and E Harnett County.
NCG12529,Raynor Swamp,Swamp,Wetlands,rises in S Gates County and flows NW to join Harrell Swamp and Duke Swamp in forming Bennetts Creek. Recorded as Meherrin Swamp in eighteenth-century land grants and deeds.
NCG12530,Raynors Lake,Lake,Water,a crescent-shaped lake on Cypress Creek in SE Duplin County.
NCG12542,Reasonover Lake,Lake,Water,in SE Transylvania County in Reasonover Creek. Covers 16 acres and has a max. depth of 22 ft.
NCG12558,Red Hill Swamp,Swamp,Wetlands,"the lower course of Brown Marsh Swamp, which see. The name is applied at the Bladen-Columbus county line, and it flows S across Columbus County. At the junction with Western Prong, the name is changed to White Marsh, which see."
NCG12566,Red Oak Cove,Valley,Landform,NW Haywood County on the head of Low Gap Branch in Great Smoky Mountains National Park.
NCG12598,Redmans Cove,Cove,Water,S Buncombe County SW of Hogback Ridge.
NCG12602,Redstone Point,Point,Landform,"on the mainland of N Dare County extending into Croatan Sound. The William B. Umstead Bridge, approx. 3 mi. long and opened on December 22, 1956, extends from the point to Weir Point on NW Roanoke Island; named for Governor William B. Umstead (1895-1954)."
NCG12606,Reed Cove,Cove,Water,E Haywood County on N side of Fork Mountain. Reed Creek flows W through the cove.
NCG12610,Reed Marsh,Marsh,Wetlands,rises in S Nash County and flows SW into Haw Branch.
NCG12617,Reeds Point,Point,Landform,a point extending from the mainland of NE Dare County into Croatan Sound.
NCG12623,Reedy Creek Bay,Bay,Water,an arm of Big Colly Bay in NE Bladen County.
NCG12629,Reedy Island,Island,Landform,an elevated sand and loam area approx. ¼ mi. wide and ¼ mi. long in E Duplin County approx. 2 mi. SE of community of Hadley.
NCG12633,Reedy Pocosin,Pocosin,Wetlands,"the NW section of Big Pocosin, SW Beaufort County."
NCG12634,Reedy Swamp,Swamp,Wetlands,rises in E Robeson County and flows S into Ten Mile Swamp.
NCG12666,Reps Martin Island,Island,Landform,"14-acre sandy island in Yadkin River, NE Yadkin County."
NCG12685,Reynolda Lake,Lake,Water,"seminatural lake on Silas Creek on Reynolda Estate near the Wake Forest University campus in central Forsyth County. Covers 25 acres, with a max. depth of 15 ft. Used for fishing, boating, swimming, and irrigation. Not open to the public."
NCG12686,Reynolds Cove,Cove,Water,NW Buncombe County NE of Rocky Knob.
NCG12691,Rhea Cove,Cove,Water,N Cherokee County at the head of Rhea Branch.
NCG12696,Rhodarme Cove,Cove,Water,E Haywood County on the head of Kems Branch.
NCG12701,Rhodes Point,Point,Landform,central Onslow County in Farnell Bay in Camp Lejeune Marine Corps Air Station.
NCG12704,Rhodhiss Lake,Lake,Water,"on the Catawba River, Burke and Caldwell Counties. Formed 1924-25. Covers 3,515 acres, with a shoreline of 90 mi. Owned by Duke Power Co. and site of hydroelectric power plant."
NCG12711,Rice Cove,Cove,Water,E Haywood County on the head of Rice Cove Creek.
NCG12715,Rice Island,Island,Landform,"in SE Bertie County between Roanoke River and Eastmost River. A large swampy island, it measures almost 2½ mi. from tip to tip and is approx. 1 mi. wide at its greatest width. See also Purchace Islands."
NCG12720,Rices Pocosin,Pocosin,Wetlands,a swamp in central Greene County.
NCG12723,Rich Cove,Cove,Water,between Laurel Mountain and Big Creek in NW Henderson County.
NCG12757,Richland Lake,Lake,Water,central Guilford County formed by dam on Richland Creek. Built in 1943 by Cone Mills and used for industrial and municipal purposes.
NCG12760,Richland Swamp,Swamp,Wetlands,"rises in S Hoke County and flows SE into Robeson County, where it enters Big Raft Swamp."
NCG12770,Richmond Millpond,Millpond,Water,"NW Scotland County on Gum Swamp Creek. Formed prior to 1800 and known until 1893 as Malloys Pond for Charles Malloy, original owner. Covers 75 acres; max. depth 18 ft. Named because it was located in Richmond County when it was formed."
NCG12781,Riddie Cove,Cove,Water,W Haywood County on Big Spring Branch.
NCG12823,Riley Cove,Cove,Water,E Clay County between Chunky Gal Mountain and Buck Creek.
NCG12849,River Swamp,Swamp,Wetlands,rises in SE Brunswick County and flows NW into Lockwoods Folly River.
NCG12863,Roan Island,Island,Landform,"a silt island in S Pender County approx. 4 mi. long and 1½ mi. wide; surrounded by Cape Fear River, Thoroughfare, and Black River."
NCG12873,Roanoke Island,Island,Landform,"approx. 11 mi. long and 2¼ mi. wide, E Dare County; it is separated by Roanoke Sound from Bodie Island (Outer Banks) on the E and from the mainland by Croatan Sound on the w. Site of Fort Raleigh, center of English exploration and settlement, 1584-87. Name believed to be of Algonquian Indian origin signifying ""northern people"" or ""northerners,"" referring to the fact that the Indians lived on the N end of the island or that they had earlier migrated from an ancestral home in the n. The name Roanoke also came to be applied to shell beads. Site of freedman's colony, 1865. Fort Raleigh National Historic Site is on the N end of the island. See also Manteo; Carteret."
NCG12874,Roanoke Marshes,Islands,Landform,"extensive string of low marsh islands in Croatan Sound, E central Dare County stretching from SW end of Roanoke Island to a large marshy area on the mainland. Site of a beacon est. approx. 1875; last of manually operated lights along the coast replaced by automatic beacon in 1955. The islands for the most part have washed away. Shown on the Collet map, 1770, as Daniels Marshes. Unnamed but shown prominently on the Moseley map, 1733."
NCG12877,Roanoke Rapids Lake,Lake,Water,"is formed by a dam near the city of Roanoke Rapids in NE Halifax County on Roanoke River. The lake extends NW along the Halifax-Northampton county line to Gaston Dam. The dam there was completed in 1955, and the lake covers 4,900 acres, with a shoreline of 47 mi. and a max. depth of 90 ft. Built by Virginia Electric and Power Company to generate hydroelectric power, the lake is also used for recreation. See also Lake Gaston."
NCG12881,Roanoke Sound,Sound,Water,"between Roanoke Island and the Outer Banks in E Dare County. Known in the eighteenth century as Sanderson's Channel for Richard Sanderson, local landowner. The name Walter Rawleigh appears there on the Collet map, 1770, though it is uncertain whether it was intended to represent the name of the sound. See also Albemarle Sound."
NCG12908,Roberts Cove,Cove,Water,in E Haywood County on the head of Rush Fork.
NCG12913,Robertsons Pond,Pond,Water,"E Wake County on Buffalo Creek. Formed in 1900. Covers 65 acres, with a max. depth of 15 ft. Used for recreation and as power source."
NCG12919,Robinson Cove,Valley,Landform,the valley through which Robinson Creek flows in NW Buncombe County.
NCG12926,Robinwood Lake,Lake,Water,"SE Gaston County on Anthony Creek. Formed 1947. Covers 35 acres. Max. depth 25 ft. Swimming, fishing, boating."
NCG12948,Rock Hollow,Valley,Landform,E Haywood County between Soapstone Gap and Sheep Mountain.
NCG12954,Rock Point,Point,Landform,"S Carteret County, extends N from central Bogue Banks W of community of Salter Path."
NCG12976,Rockingham Lake,Lake,Water,"privately owned lake built 1939 on tributary of Lower Hogans Creek, Rockingham County."
NCG12993,Rocky Cove,Cove,Water,W Macon County on a tributary of Nantahala River.
NCG13012,Rocky Hollow,Valley,Landform,W Watauga County between Laurel Creek and Watauga River.
NCG13038,Rocky Swamp,Swamp,Wetlands,"rises in W Halifax County and flows SE into Fishing Creek. Appears on the Collet map, 1770."
NCG13049,Rodman's Point,Point,Landform,"near the mouth of Rodman's Creek, W Beaufort County on the S side of Pamlico River."
NCG13055,Rogers Cove,Cove,Water,E Haywood County on the head of Rogers Cove Creek.
NCG13064,Rogers Swamp,Swamp,Wetlands,rises in N Northampton County and flows SE to join Corduroy Swamp in forming Kirbys Creek.
NCG13068,Roland Hollow,Valley,Landform,W central Yancey County on W side of Cane Mountain. Contains a tributary of Higgins Creek.
NCG13086,Roquist Pocosin,Pocosin,Wetlands,SW Bertie County.
NCG13137,Round Cove,Valley,Landform,NE Cherokee County in the Valley River Mountains.
NCG13154,Rouse Pond,Pond,Water,on the head of Grape Branch in N Duplin County.
NCG13177,Royal Oak Swamp,Swamp,Wetlands,rises in Green Swamp in central Brunswick County and flows E into Lockwoods Folly River.
NCG13178,Royal Point,Point,Landform,"on the Pamlico Sound side of Portsmouth Island approx. 3 mi. from Drum Inlet, E Carteret County."
NCG13197,Rumley Bay,Bay,Water,"a small bay in SE Cedar Island, NE Carteret County. Named for the Rumley family."
NCG13198,Rumley Marsh,Peninsula,Landform,"a tidal-marsh peninsula approx. 1¾ mi. long and ¾ mi. wide on the N shore of Pamlico River S of Jackson Swamp, E Beaufort County. Appears as Rumneys Marsh on the Collet map, 1770."
NCG13202,Run of Swamp,Swamp,Wetlands,a canal that drains the Big Pocosin in SW Gates County and empties into Chowan River.
NCG13203,Run of the Mill Pond,Pond,Water,a stream that rises in SE Duplin County and flows N into Jump and Run Branch.
NCG13238,Ryders Pond,Pond,Water,"E Warren County on Little Fishing Creek. Covers approx. 10 acres, with a max. depth of 4 ft."
NCG13242,Rye Swamp,Swamp,Wetlands,rises in W Sampson County and flows SW into Little Coharie Creek.
NCG13253,Saddletree Swamp,Swamp,Wetlands,rises in N Robeson County and flows S into Lumber River.
NCG13274,Salem Lake,Lake,Water,"NE Forsyth County, is fed by Lowery Mill Creek, Kerners Mill Creek, and other streams. Formed 1942. Covers 400 acres, with a max. depth of 35 ft. Source of water for Winston-Salem."
NCG13300,Salters Lake,Lake,Water,"a natural lake in central Bladen County on Ellis Creek 6 mi. N of Elizabethtown. Covers 315 acres, with a max. depth of 10 ft. State owned and open to the public. Fishing, swimming, and boating. Part of Jones Lake State Park, which see."
NCG13312,Sam Cove,Cove,Water,NW Graham County on Deep Creek.
NCG13326,Sampson Point,Point,Landform,"S Currituck County E of community of Point Harbor, extends into Albemarle Sound. Shown on U.S. Coast Survey map, 1865."
NCG13337,Sand Hill Cove,Cove,Water,E Pender County on Northeast Cape Fear River.
NCG13341,Sand Point,Point,Landform,"NE Carteret County, extends from W side of central Cedar Island into West Bay."
NCG13342,Sand Point,Point,Landform,"on NW shore of Roanoke Island, extends W into Croatan Sound, NE Dare County."
NCG13347,Sanders Island,Island,Landform,E Onslow County in Brown's Sound between the mouths of Bear and Sanders Creeks.
NCG13349,Sanders Point,Point,Landform,"W Carteret County, extends into Bogue Sound W of the mouth of Goose Creek."
NCG13350,Sanderson Fish Pond,Pond,Water,on a tributary of Cabin Creek in E central Duplin County.
NCG13358,Sandy Bay,Bay,Water,in the waters of Pamlico Sound off the SE mainland of Dare County between Sandy Point on the N and Parched Corn Point on the s.
NCG13359,Sandy Bay,Bay,Water,"a bay in the waters of Pamlico Sound off the coast of Hatteras Island, SE Dare County. It lies between Durant Point, near the town of Hatteras, and Frisco."
NCG13379,Sandy Point,Point,Landform,"appears on the Gascoyne map, 1682, as the point of land presently in SE Bertie County between Salmon Creek and Roanoke River. It also appears on the Hack map, 1684."
NCG13388,Sandy Run Swamp,Swamp,Wetlands,"rises in W Onslow County and flows SW into Pender County, where it enters Holly Shelter Creek."
NCG13397,Santeetlah Lake,Lake,Water,"central Graham County, was formed in 1928 by a dam on Cheoah River. Covers 2,580 acres, with a shoreline of 105 mi. Max. depth 240 ft. Alt. 1,940. Used for power, fishing, and boating."
NCG13405,Sapphire Lake,Lake,Water,"S Jackson County on Horsepasture River and Nix Creek. Formed by 1916; covers 50 acres, with a max. depth of 20 ft. Part of ""Sapphire Country,"" which see. Used for fishing, swimming, and boating; not open to the public. See also Lake Sapphire."
NCG13428,Sassarixa Swamp,Swamp,Wetlands,rises in W Johnston County and flows SE into Black Creek.
NCG13431,Sassers Millpond,Millpond,Water,"N Wayne County on Great Swamp near Aycock Millpond. Fishing, boating; open to public."
NCG13446,Saunders Bay,Bay,Water,"in Currituck Sound off the W shore of Currituck Banks and N of Mossey Islands, SE Currituck County."
NCG13447,Saunders Point,Peninsula,Landform,peninsula extending from NE Pamlico County into Bay River.
NCG13472,Sawyer Cove,Cove,Water,N Buncombe County E of Ingles Ridge.
NCG13503,Schulkens Pond,Pond,Water,a natural lake in SE Columbus County approx. 7 mi. SW of Lake Waccamaw and 1 mi. W of Waccamaw River. Bear Branch drains Schulkens Pond into Waccamaw River.
NCG13505,Scippco Swamp,Swamp,Wetlands,"rises in Cawcaw Bay, SW Brunswick County, and flows W into Waccamaw River."
NCG13523,Scott's Pond,Pond,Water,"W Wilson County on Robin Branch. Formed 1954 and named for Exum Scott, owner. Covers 10 acres; max. depth 12 ft. Fishing, swimming, boating, irrigation."
NCG13533,Scratch Hall Swamp,Swamp,Wetlands,rises in W Gates County and flows W into Chowan River.
NCG13554,Seago's Lake,Lake,Water,E Anson County SE of Lilesville. Covers approx. 10 acres; max. depth 20 ft. Formed early in the twentieth century when gravel was removed from the site. Named for owner.
NCG13568,Second Creek Point,Point,Landform,"E Tyrrell County, extends from the mainland into Alligator River near the mouth of Second Creek."
NCG13582,Sega Lake,Lake,Water,"in central Transylvania County on Graham Creek. Covers ¼ acre, with a max. depth of 10 ft."
NCG13604,Sessoms Mill Pond,Pond,Water,on Chinkapin Creek in SE Hertford County; approx. ½ mi. long.
NCG13622,Sevenmile Swamp,Swamp,Wetlands,rises in NW Sampson County and flows SE into Great Coharie Creek.
NCG13632,Shackleford Point,Point,Landform,"the W tip of Shackle ford Banks, SE Carteret County, extending into Beaufort Inlet. The community of Shackleford formerly existed near the point."
NCG13635,Shad Point,Point,Landform,on the NE mainland of Hyde County extending into the mouth of Long Shoal Bay.
NCG13656,Shallotte Sound,Sound,Water,SW Brunswick County between Brantley Island on the mainland and Hales Beach running parallel to and S of the Intracoastal Waterway. Narrow and approx. 1½ mi. long.
NCG13659,Shallowbag Bay,Bay,Water,"a bay in Roanoke Sound off the NE shore of Roanoke Island, E Dare County. The bay forms the harbor at the town of Manteo. In the late eighteenth century, it was referred to as Shalon-bas Bay (French chalonbas, ""low trawl net""). Roanoke voyages-period vessel Elizabeth II, a reproduction, rests in bay."
NCG13666,Shanty Cove,Cove,Water,E Cherokee County on the headwaters of Seibold Branch.
NCG13708,Sheep Hollow,Valley,Landform,S Macon County between Richey Knob and Richey Gap.
NCG13709,Sheep Island,Island,Landform,"in Pamlico Sound off Portsmouth Island and separated from it by Baymarsh Thorofare, E Carteret County."
NCG13728,Shell Island,Island,Landform,"NE Carteret County in Core Sound between Wainwright Island and Core Banks. Named as early as the Moseley map, 1733. See also Hunting Quarter Sound."
NCG13734,Shellback Island,Island,Landform,"a tidal-marsh island in the Cape Fear River opposite Southport, SE Brunswick County."
NCG13735,Shellbank Point,Peninsula,Landform,"peninsula extending from the W shore of N Bodie Island into Kitty Hawk Bay and Currituck Sound, NW Dare County. Named for mound of shells found at the site by early settlers."
NCG13737,Shelly Point,Point,Landform,extends from the mainland of SW Carteret County into Bogue Sound.
NCG13738,Shelly Point,Point,Landform,"SE Onslow County on The Hammock, extends into White Oak River."
NCG13743,Shelter Swamp,Swamp,Wetlands,"rises in S Onslow County and flows W into Pender County, where it enters Holly Shelter Creek."
NCG13758,Shepherd Millpond,Millpond,Water,on Briery Swamp in NE Pitt County.
NCG13762,Shepherd's Point,Point,Landform,"a name formerly applied to the point of land on the W side of Newport River on which Morehead City now stands. Appears on the Moseley map, 1733."
NCG13791,Shingle Cove,Cove,Water,S Haywood County on Richland Creek.
NCG13796,Shingle Point,Point,Landform,"the W side of an unnamed island off Core Banks in Core Sound, E Carteret County. The island is between Goose Island on the S and Duges Island on the n."
NCG13799,Shingletree Swamp,Swamp,Wetlands,rises in SW Brunswick County and flows NW into Cawcaw Swamp on W edge of Thomas Bay.
NCG13810,Ship Point,Point,Landform,"N Tyrrell County, extends from the mainland into Albemarle Sound."
NCG13843,Shop Cove,Cove,Water,on the Beaufort-Pitt County line at the confluence of Tar River and Tranters Creek.
NCG13846,Shope Cove,Cove,Water,N Macon County on a tributary of Burningtown Creek.
NCG13912,Silver Hill Pocosin,Pocosin,Wetlands,a muck-filled area approx. 4 mi. by 4½ mi. in NW Pamlico County.
NCG13915,Silver Lake,Lake,Water,"NW Wilson County on Toisnot Swamp. Covers 175 acres; max. depth 12 ft. Fishing, swimming, boating, and municipal water supply. Formed in 1785 by John Dew and known as Dew's Mill until about 1847. Called by the name of various owners until about 1922, when present name was applied."
NCG13929,Silvers Cove,Cove,Water,E Haywood County on the head of Silvers Cove Creek.
NCG13936,Simmons Cove,Cove,Water,N Buncombe County W of Paint Fork community.
